Bellingcat,Perform investigative journalism,Bellingcat uses crowdsourced information for investigative journalism. It also runs workshops to train people on using web resources for research investigation.,2.0,,1.0,,,,,1.0,1.0,,1.0,,,1.0,,,,,,1.0,,,,,1.0,,,,
Golden.com,"Search companies or topics, supported by humans in the review workflow","golden.com that provides accurate semantic search on companies or topics of interest, for use in consulting, investment or financial services for example. The company Golden in particular has emphasized the synergy between machine and human curators, by enabling workflows allowing editors to improve content quality.",2.0,2.0,,,1.0,,,1.0,,,1.0,,1.0,1.0,1.0,,,,,,,,,,,,,,
Geofencing,Identify the position of individuals or assets through digital means,"Geofencing is the practice of identifying the physical position of an individual or asset through digital means (for instance mobile phone GPS), and monitoring its position to detect trespassing and trigger additional action (such as notifying people at vicinity, or security forces).",2.0,,,,,,,,,,1.0,,,1.0,,,,,,,,,,,,,,,
Taliban,Coordinate insurgencies' military operations,"The takeover of Afghanistan in 2021 by the Taliban is a somber reminder of how effective the pervasive use of comparatively simple collaboration technology (in this case, WhatsApp groups) can be.",2.0,,,2.0,,,,,2.0,2.0,1.0,2.0,,1.0,,1.0,,,,1.0,,,,,,,,,
Africa Pathogen Genomics Initiative,Use genomic surveillance networks to detect Covid-19 variants,"When additional variants of the virus started to emerge, genomic surveillance networks across the world proved invaluable – for instance, the Africa Pathogen Genomics Initiative, first established to track Ebola and yellow fever. [Source: Azeem Azhar, ""Exponential""]",2.0,1.0,,,,2.0,,,,2.0,1.0,,,1.0,,,,,1.0,1.0,,,,,,,,,
Mercicorps' Agrifin,Detect spread of locusts,"Mercicorps’ Agrifin provides a platform for African countries to use multiple sources, including crowdsourced input, to detect the spread of locusts",2.0,,,,,,,2.0,,2.0,1.0,,,1.0,,,,,,,,,,,,1.0,1.0,,
Artificial Intelligence in Medical Epidemiology (AIME),Predict a crisis before it happens,"Dengue is a mosquito-borne infection and major international public health concern, with severe dengue affecting many Asian and Latin American countries and up to 2.5 billion people worldwide. A major challenge in many dengue endemic countries is that disease surveillance is often passive and reliant on case reporting by health workers, meaning it can be difficult to ensure completeness and timeliness of data. Often dengue outbreaks have occurred or even passed their peak before they are registered by systems. Time delays and poor predictive capability mean that public health officials are missing vital opportunities for disease control and to implement a timely localised response. Predicting outbreaks is of paramount importance as there is no treatment to prevent or stop dengue, and the WHO recommends that the vaccine only be given to persons with confirmed prior dengue virus infection, thereby leaving large swathes of the population in disease endemic countries at risk.  What is the CCI solution? Artificial intelligence in Medical Epidemiology (AIME) is an early warning system incorporating AI to identify and forecast dengue outbreaks with a high accuracy and spatial precision. AIME leverages the intelligence of local doctors and healthcare professionals and combines this with a wide range of data sources and machine learning to predict (and therefore prevent) disease outbreak.  AIME uses real-time data generated by doctors, who send in notifications of dengue cases via AIME’s subsystem (REDINT); this can be accessed by hospitals within a community/ region, enabling them to immediately update and report dengue cases to the public health municipality. Case data is combined with existing datasets of variables that influence the spread of dengue – from local terrain and elevation to roofing types and thunderstorms, as well as official data about the local population and socioeconomic variables. The AIME platform combines data and uses a machine learning algorithm in order to predict, geo-locate and determine future outbreaks. The platform enables surveillance of current disease outbreaks, by determining their exact location, and can forecast future outbreaks. (Source: Nesta UK)",2.0,,,,,,,2.0,,2.0,1.0,,,1.0,,,,,1.0,1.0,,,,,,,,,
Managing Information in Natural Disasters (MIND),Provide real-time situational information for more effective response,"During a natural disaster, access to accurate, consistent and timely information can be limited. This can slow, and sometimes prevent, responders from acting and collaborating in a crisis. As a result, different response efforts may be using different datasets and information, and therefore not supporting the communities most in need. What is the CCI solution? MIND is an automated open source platform created by UN Global Pulse that collects and processes data from a range of sources and presents this data through a single aggregated platform that all responders can use when coordinating response to a natural disaster. How is it being done? The platform is built on an automated data pipeline (using a number of APIs), allowing it to stream and analyse several non-traditional data sets all in one place. This includes data generated by affected communities local to the incident taking place and scraped from Twitter and Google searches, as well as information from Wikipedia and OpenStreetMap about the location, casualty reports from news sources, and data from the International Aid Transparency Initiative, showing details about projects and organisations in the affected areas. The automated collection and processing of the data is triggered based on disaster alerts received from the Global Disaster Alert and Coordination System (GDACS), which is a global system aimed at closing information and coordination gaps.",2.0,,,,,1.0,,2.0,,1.0,1.0,,,1.0,,,,,,1.0,,,,,,,,,
RapiD (Map with AI),Provide real-time situational information for more effective response,"For 15 years, thousands of volunteers have used OpenStreetMap (OSM) to create a free and open map of the world. The community of mappers help build OSM by adding manually captured data, importing and reviewing open public data or official data (such as satellite images) and annotating features like roads, highways and bridges. While mappers may be remote, local communities can also use the tool to map their local neighbourhoods. Despite the popularity of OSM, many areas remain unmapped, unvalidated or incorrectly labelled. This is mostly because crowd annotation of maps is time- and labourintensive for volunteers and finding an equivalent number of real-life validators is difficult. Maps are not static – particularly in vulnerable regions affected by conflict (such as where borders may be disputed) and environmental crises – so they may require remapping if an area experiences rapid changes in infrastructure. These areas need constant monitoring, which is difficult to achieve manually. Accurate maps play an essential role in crisis situations by supporting the response efforts of frontline workers, aid organisations, national and international government bodies by helping them to understand the scale of impact, and effectively target and coordinate relief. What is the CCI solution? The Humanitarian OpenStreetMap Team (HOT) is a dedicated community that uses OSM to support responses to crises, such as urban floods and migration, by mapping vulnerable regions. In 2018, HOT launched the MapWithAI initiative (in partnership with Facebook) which elevates the collective intelligence of volunteers by using artificial intelligence (AI) to drive the speed, efficiency and scale of mapping efforts. How is it being done? MapWithAI uses computer vision to detect roads and terrain features of the streets on high-resolution satellite imagery. Trained using years of volunteer-labelled satellite data, complex patterns in images are identified by an algorithm known as a deep neural network segmentation model. This model estimates the probability that each pixel is part of a road, predicts and draws potential roads, and generates an enhanced image for the volunteer community through an editing tool called RapiD. Using RapiD, volunteers verify the AI generated roads, helping to identify errors in the model and contribute to its improvement. The project initially focused on the response to flooding in Kerala, India, but has since been integrated into the HOT volunteer-management platform for deployment on other projects. Project managers and volunteers can opt-in to use the tool or continue mapping without it. Using RapiD, volunteers are able to create maps of disaster affected regions more quickly. Projects carried out through the HOT task manager platform draw on contributions from a wide range of participants including local volunteers and frontline responders, particularly for validation of remote mapping efforts. (Source: Nesta UK)",2.0,,,,,1.0,,2.0,,1.0,1.0,,,1.0,,,,,,1.0,,,,,,,,,
Zika mitigation with Premise,Predict a crisis before it happens in Colombia,"Over one million people die a year from mosquito borne diseases, and in 2016, the city of Cali in Colombia suffered the second largest Zika virus outbreak in the world as a result of a lack of data and control on mosquito populations. To prevent and limit these outbreaks, a vast amount of data is required to identify and remove breeding grounds, such as standing water. Monitoring locations across a city or region is a laborious process that requires a large number of people to regularly collect data. What is the CCI solution? Utilising a citizen network in and around the city of Cali, the Premise platform provided a tool to allow affected communities to crowdsource data and monitor conditions in hard-to-reach geographies. Citizens are trained through the Premise app and offered micropayments as incentives to collect data, which can then be visualised for authorities to monitor and respond to mosquito breeding sites. The platform also enables a collective mitigation response by informing citizens of best practice in vector surveillance and control. How is it being done? The Premise crowdsource platform relies on a four step process: configure, collect, quality control and visualise. First, the city authority and Premise community managers establish the questions that need to be asked to the citizen network to collect the data that is required for a targeted response. This is configured into the platform with appropriate instructions to ensure a consistency and quality to data collection. The citizen contributors’ network then begin collecting data, incentivised through behavioural nudges and micropayments, and upload the data to the Premise platform. Premise utilises AI to quality control the uploaded data and identify any false or duplicative entries. Finally, this data is visualised on the Premise platform for both the community and authorities to work together to identify and remove potential breeding grounds. (Source: Nesta UK)",2.0,,,,,1.0,,1.0,,1.0,1.0,,,1.0,,,,,1.0,1.0,,,,,,,,,
eBayanihan,"Provide real-time situational
information for more effective response ","When a natural disaster strikes, such as Typhoon Lando (Koppu) in the Philippines, it can be challenging for affected communities to communicate with first responders about the scale of the disaster and the support that is required. Equally, first responders, operational  managers and government agencies often use a multitude of data sources to coordinate response that do not always reflect the support needs of affected groups. What is the CCI solution? eBayanihan is a muti-channel platform that enables citizens to view and upload reports of natural disasters and community needs, providing a direct link to first responders, operational managers and government agencies. Citizens are therefore able to express the support that is  equired in their affected communities, rather than responders focusing on the mapped impact of the natural disaster. First responders, operational managers and government agencies therefore have a single source of data that informs how to target their response, visualised through a dashboard and interactive map. How is it being done? Affected communities uploaded citizen reports (CitReports) that describe the damage caused by Typhoon Lando, as well as the needs of the community, such as shelter, food and water via multiple channels including SMS, web and an app. Machine learning algorithms help to model and validate these crowdsourced CitReports – categorising and visualising them for operational teams to respond to. These feed into a real-time dashboard visualising incidents and automating notifications to people managing, responding to or coordinating the response of natural disasters.  (Source: Nesta UK)",2.0,,,,,,,2.0,,,1.0,,,1.0,,,,,,1.0,,,,,,,,,
Restor.eco,Crowdsource database and foster community for environmental restoration,"Restor is a science-based open data platform to support and connect the global restoration movement, accelerating the global restoration movement by connecting everyone, everywhere to local restoration. Restor connects people to scientific data, supply chains, funding, and each other to increase the impact, scale, and sustainability of restoration efforts. Participants can Analyse restoration potential for any area anywhere, Monitor and manage all their restoration projects in one place, Share projects to show progress and support the movement, and Connect with the movement (e.g. Explore sites locally and globally, Find potential partners doing similar work, Search using a range of scientific and social filters, Share contact information to connect directly with other users.)",2.0,,,1.0,,1.0,,1.0,1.0,1.0,1.0,1.0,1.0,1.0,,,,,,1.0,,,,,,,1.0,,
Empirical economics,Use open data for economic for modeling and forecast,"The ubiquity of sensors, combined with the availability of machine learning and other computationally sophisticated methods and infrastructure, is also bound to change the field of economics. GDP measurement is a hierarchical effort, lacks granularity and speed, and is subject to significant manual intervention. Information like restaurant booking OpenTable can help surface early signals to sense changing conditions and inform trend estimates in ways that were previously impossible.",2.0,,,1.0,1.0,,,2.0,,,1.0,,2.0,,1.0,,,,,,,,,,,,,,
UK government,Channel messages from citizens to their representatives,www.writetothem.com helps citizens contact their elected representatives to pressure them on important issues and generally keep them accountable for their role in democratic representation,2.0,,,,,,,2.0,1.0,,1.0,1.0,,,,,1.0,,,1.0,,,,,,,,,
GEMS,"Decentralize a network of sensors, distributing air pollution data","Run by UNEP and Swiss technology company IQAir, GEMS is the largest air pollution network in the world, covering some 5,000 cities. In 2020, over 50 million users accessed the platform and its data is being streamed into digital billboards to alert people about air quality risks in real time. In the future, the program aims to extend this capability directly into mobile phone health applications.",2.0,,,,1.0,,,2.0,,2.0,1.0,,,1.0,,,,,,,,,,,,,1.0,,
GEM,Enable open-source mapping of power generation and other energy intensive plants,"Wiki based https://globalenergymonitor.org/ enable energy analysts, scientists, activists by pinpointing coal and gas plants globally, as well as wind, steel etc. Data includes capital flows and progress of building those capital assets",2.0,2.0,,,,,,1.0,,,1.0,,,1.0,,,,,,,,,,,,,1.0,,
Mozilla Rally,Collect data for research,"Mozilla's Firefox plugin ""put your data to work to help Mozilla and research partners address (e.g. university researchers) areas such as ethical AI, online privacy, algorithmic bias, discrimination, and misinformation."" It is called ""Dataraising""",2.0,,,,1.0,,,1.0,,,1.0,,1.0,,1.0,,,,,,,,,,,,,1.0,
Plos Climate,Open-source peer reviewed scientific research,The US Public Library of Science launched in early 2022 a freely accessible journal supported by a global editorial board with the mission of sharing some of the best and most important climate research (https://journals.plos.org/climate/) and offer a conduit for the dissemination of interdisciplinary work that crosses the boundaries of traditional disciplinary siloes.,2.0,1.0,,,,1.0,,2.0,,,1.0,,,1.0,,,,,,,,,,,,,,1.0,
Open Forest Protocol,Use NFTs to create forestation registries,"Openforestprotocol.org is a community of climate change forestation project operators, validators and funders that uses blockchain technology for its records and transactions. Of particular note is the storage of immutable land-registry forestry records (including validated location, representative imagery) as non-fungible Ethereum blockchain tokens (NFTs).  ",2.0,2.0,,1.0,,,1.0,,1.0,,1.0,1.0,1.0,1.0,1.0,,,,,,,,,,,,1.0,,
Bellingcat,Crowdsource military radar tracking,The open-source Radar Interference Tracker (RIT) allows anyone to search for and potentially locate active military radar systems anywhere on earth. The Bellingcat Investigative Tech Team (part of investigative community Bellingcat) has also published the source code for the RIT tool on it on its Github page.,2.0,,,,,,,1.0,,,1.0,,1.0,1.0,,,,,,1.0,,,,,1.0,,,,
Animal biologging,Monitor animal behavior to forewarn of impeding natural disasters ,"Scientists have found that certain species of animals are able to sense the impending arrival of a natural disruption, such as an earthquake or a tornado. Experiments are apace trying to combine biologged signals from different animals in different locations to triangulate the possible riskiest areas, possibly in combination with other instrumental measurements. ",2.0,,,,,,,2.0,,1.0,1.0,,1.0,1.0,,1.0,,,,,,,,,,,1.0,,
Global Fishing Watch,Provide open-access data about fishing impact,"A decade ago, building an open-access picture of global fishing activity was out of reach. But thanks to advances in satellite technology and machine learning, Global Fishing Watch is now making it a reality.",2.0,,,,,,,1.0,,,1.0,1.0,,1.0,,,,,,,,,,,,,1.0,,
Safecity.in,Crowdsource sexual violence reports,"Safecity is a platform that empowers individuals, communities, police and city government to create safer public and private spaces. Its technology stack collects and analyses crowdsourced, anonymous reports of sexual violence, identifying patterns and key insights.",2.0,,,,,,,1.0,,,1.0,,1.0,1.0,,,,,,1.0,,,,,,,,,
Infer,Inform policy through collective forecasting,"INFER is a community of researchers, analysts, and passionate forecasters that inform U.S. Government policymaking by generating signals and early warning about the future of science and technology trends and events.",2.0,,,,,1.0,,1.0,,1.0,1.0,,,1.0,,,,,,1.0,,,,,,,,,
treezilla.org,Map UK trees,"Interactive, crowdsourced map of tree assets and their positive impact",2.0,1.0,,,,1.0,,,1.0,,1.0,,,1.0,,,,,,,,,,,,,1.0,,
SIKU,Harness indigenous knowledge,"Inuit ice knowledge combined with geospatial data. Community driven mapping of ice conditions and interpretation of related risks, to increase safety https://en.unesco.org/courier/2019-1/siku-mixing-high-tech-ancient-know-how",2.0,1.0,,,,1.0,,,1.0,,1.0,1.0,,1.0,,,,,,1.0,,,,,,,1.0,,
cocorahs.org,Enable community driven weather watch in Colorado,"CoCoRaHS ""is a grassroots volunteer network of backyard weather observers of all ages and backgrounds working together to measure and map precipitation (rain, hail and snow) in their local communities. By using low-cost measurement tools, stressing training and education, and utilizing an interactive Web-site, our aim is to provide the highest quality data for natural resource, education and research applications.""",2.0,1.0,,,,1.0,,,1.0,,1.0,,1.0,1.0,,,,,,1.0,,,,,,1.0,1.0,,
ipaidabribe,Identify corrupted public officials,"Crowdsourced, anonymized surfacing of instances of bribes encountered by citizens in India when dealing with their public services providers",2.0,1.0,,,,,,,1.0,,1.0,,1.0,,,,1.0,,,1.0,,,,,,,,,
New Zealand census,Use administrative data for estimating census,Census Transformation Programme (New Zealand) used administrative data to provide an alternative method of producing a census (source: Nesta UK),2.0,,,,,1.0,,,,,1.0,,1.0,,,,1.0,,,1.0,,,,,,,,,
organjet.com,Help the organ-donation market clear,"OrganJet provides an information service, as well as options for timely and affordable air transport, for patients who are multi-listed or distant listed for organ transplants in the U.S.",2.0,,,1.0,,1.0,1.0,,,,1.0,,,,1.0,,,,1.0,,,,,,,,,,1.0
PlumeLabs,Aggregate air quality data ,"Plume's technologies provide air quality information for any location —getting right down to street level in over 100 major cities around the world. They draw on over 12,000 monitoring stations and own models, integrating a large amount of data including weather information, population density, land-use and road networks.",2.0,1.0,,,1.0,1.0,,,,1.0,1.0,,1.0,,1.0,,,,,,,,,,,,1.0,,
bluedot.global,Detect diseases and disruption outbreaks,"Bluedot collates and analyzes sources such as local news and other databases, in order to identify emerging health risks such as pandemics.",2.0,,,,,1.0,,1.0,,,1.0,,1.0,1.0,1.0,1.0,,,1.0,,,,,,,,,,
dClimate,Provide environmental data through a decentralized web3 platform,"dClimate is a transparent, decentralized marketplace where climate data, forecasts, and models are standardized, monetized, and distributed. The marketplace connects data publishers directly with data consumers, making climate data more accessible and reliable. When data providers share data and forecasts with the market it is automatically scored for reliability, which helps consumers to shop for information. In exchange, dClimate creates a simple, direct-to-consumer distribution mechanism to monetize their work. dClimate's base layer is built on Ethereum, and the network leverages Chainlink's leading decentralized oracle network to  facilitate on-chain validation and support for dClimate's governance layer. dClimate starts on day one with a foundation of dozens of terabytes of standardized climate data ready for institutional use and anchor-client Arbol, a leading parametric weather risk platform. ",2.0,2.0,,1.0,,,1.0,1.0,1.0,,1.0,1.0,2.0,1.0,1.0,,,,,,,,1.0,,,,1.0,,
Frog ID,Detect species exctinction risk,"https://www.frogid.net.au/ empowers volunteers in the field to log sightings, so that other volunteers can study patterns that might hold clues on the depletion of natural stock of frogs.",2.0,1.0,,,,,,,1.0,1.0,1.0,,1.0,1.0,,,,,,,,,,,,,1.0,,
Distributed Denial of Secrets,Crowdsleuthing,Distributed Denial of Secrets (ddosecrets.com) is a journalist 501(c)(3) non-profit devoted to enabling the free transmission of data in the public interest. It was involved in the assessment of the role of right wing platform Parler in the occupation of US Capital after Joe Biden's election to US President. ,2.0,,,,,,,,1.0,,1.0,1.0,,1.0,,,,,,1.0,,,,,1.0,,,,
Zenly,Form stronger social bonds in physical spaces,"Zenly is a mobile social app that helps users map their locations, and those of their friends, to make them meet more easily and curate information about their location habits. The aggregation of the information provides a unique user experience to the members.   ",2.0,,,,,2.0,,1.0,1.0,2.0,1.0,1.0,,2.0,,,,1.0,,,,1.0,,,,,,,
DClimate,Share climate relevant data sets,DClimate.net is a marketplace of decentralized climate data for data science work. It uses Ethereum to enable buying/selling transactions. -,2.0,,,,,,,2.0,,,1.0,,,,1.0,,,,,,,,,,,,2.0,,
Stocktwits,Predict the stock market,"Social media app Stocktiwts is in many ways similar to Twitter focuses on stocks, and features private rooms where influencers can guide individual investors. ",2.0,,,1.0,,,,1.0,,,1.0,,,1.0,,,,,,,,,1.0,,,,,,
LinkedIn feeds,"Learn relevant, emerging facts",The prioritization and display of information on a LinkedIn feed combines community- driven signals with other information intended to analyze the engagement that specific content generates.,1.0,,,,,2.0,,2.0,1.0,1.0,2.0,,,1.0,1.0,,,,,,,,,,,,,,
HumanDX.org,Improve patients therapy by combining human practices through machine learning,"The Human Diagnosis Project (Human Dx) is a worldwide effort created with and led by the global medical community to build an online system that maps the steps to help any patient. By combining collective intelligence with machine learning, Human Dx intends to enable more accurate, affordable, and accessible care for all. ""Let's end unequal access to medical knowledge"" is their motto. ",1.0,2.0,,,1.0,,,1.0,,1.0,2.0,,,1.0,,,,,1.0,,,,,,,,,,
"Slack, Microsoft Teams, Circle",Collect information and help employees collaborate,"In many companies, the foundation of a collective knowledge feeder already exists through the convergence of three things: electronic communications, especially email and more recent collaboration environments like Slack or Microsoft Teams or, in open communities, tools like Circle; organizational structures that include subject matter expert s, e.g. practice leaders in consulting firms; and pervasive information feeds fueled by the explosion of internet-based knowledge sharing from social media to specifically curated knowledge feeds.",1.0,2.0,1.0,1.0,1.0,1.0,,2.0,1.0,1.0,2.0,1.0,,1.0,,,,,,,,1.0,,,,,,,
Google Maps,Flag inappropriate content,Crowdsourced sensor data used by machines.,1.0,,,1.0,1.0,,1.0,2.0,1.0,,2.0,1.0,1.0,1.0,,,,,,,,1.0,,,,,,,
