Wolfram Alpha,Access the world's knowledge,"Wolfram Alpha uses smarter, AI based, semantic analysis to understand language and return the right information from an openly-accessible corpus. Wolfram Alpha relies on both semantics and curated, structured data derived from internet data sources. The new generation of search engines uses smarter, AI based, semantic analysis to understand language and return the right information.",1.0,2.0,,,,,,2.0,,,2.0,,2.0,,,,,,,,,,,,,,,,
"LinkedIn, Twitter",Post recommendation in professional-use social media ,"Social media sites like LinkedIn and Twitter likely walk a tightrope between prioritizing content for our viewing from weak-tie and strong-tie connections. It seems plausible that at some point people will have the ability to customize settings, so they can get exposed to more of one or the other.",1.0,,,2.0,1.0,,,2.0,,,2.0,,,1.0,,,,,,,,1.0,,,,,,,
"Python, R",Identify entities in data structures,"To map relevant people and “illuminate” the external network we first need to precisely define the language for topics of interest which can be disambiguated through what is called “entity extraction”, which helps identify the semantic field, i.e. the words, that reflect that theme – for instance “artificial intelligence” and “machine learning” and “neural network” would be branches and separate entities. The next step is some social media scraping and searching for connections or followers of initial nodal people. For instance, experts in reskilling would likely follow a few dozen core experts in that field. Having a database of key people can help connecting them.",1.0,,,,,,,1.0,,,2.0,,,,,,,,,,,,,,,,,,
The Syrian Archive,Scraping social media to find war equipment,"The Syrian Archive is an initiative using tools that scrapes social media feeds to detect and classify imagery pertaining to war equipment, with the intent of documenting and making searchable evidence of war crimes. The neural net AI curates and classifies information automatically.",1.0,2.0,,,,,,1.0,,,2.0,,1.0,1.0,,,,,,1.0,,,,,,,,,
CB Insights,Analyze markets,CB Insights is a natural language processing engine that uses advanced analytics; it monitors the venture-capital backed startup space and aggregates insights across company news,1.0,,,,,,,2.0,,,2.0,,1.0,,1.0,1.0,,,,,,,1.0,,,,,,
"Discover.ai, XiQ, Factr",Curate news,"Curation engines that aggregate content through a combination of human and AI intervention also exist (e.g., Curata but also competitive intelligence tools like XiQ.io or technologies like Discover.ai). The individual person’s ability to efficiently collect and distribute curated knowledge is also the object of recent developments, for example through Factr.",1.0,1.0,,,,,,2.0,,,2.0,,,1.0,,,,,,,,,,,1.0,,,,
Citibeats.net,Discover opinions among city dwellers,Citibeats.net have specialized in mining people’s opinion to help cities and public organizations extract insights from their constituencies.,1.0,,,,,,,,1.0,,2.0,,1.0,1.0,,,,,,1.0,,,,,,,,,
Omnity.io,Scan entire documents and finds relevant materials irrespective of their links to other websites,"Omnity.io challenges’ the premise of Google’s traditional search (based on citations and connections) to enhance the search of relevant information. Omnity doesn’t need keywords, as it is able to scan entire documents (for example, research notes) and find relevant materials on the web, irrespective of the amount of links to other websites. While Google has enhanced its search engines through knowledge graphs that enable semantic search, its algorithms still significantly reliy on web links because of the advertising value of well-connected web real estate.",1.0,,,,,,,1.0,,,2.0,,,,,,,,,,,,,,,,,,
Word2vec,Analyze scientific and innovation literature and detect of patterns,"US Department of Energy’s Berkeley National Lab used NLP to create word-based bodies of text vectors in its word2vec (machine learning) algorithm, which proved to be able to predict material science’s advances",1.0,2.0,,,,,,2.0,,,2.0,,2.0,1.0,,,,,,,,1.0,,,,,,1.0,
EyeOnText,"Democratize natural language analysis, resulting in better search and trend analysis etc. ","Enablers of hyperconnectivity rarely use artificial intelligence on natural language for anything more than basic search, grammar and spellcheck. This is a gap, given the important role that language plays in enabling large groups of people to innovate and learn together. Natural language processing (NLP) however has improved the ability for people to exchange large knowledge sets, by enabling for instance better search functions. Tools like EyeOnText simplify data science on text analytics. Text “x-ray” like what’s done by Amazon Kindle allow the automatic creation of themes that humans can peruse and recombine.",1.0,,,,,,,2.0,,,2.0,,1.0,1.0,,,,,,,,,,,,,,,
MediaWiki,Search curated web information,"Semantic MediaWiki “is a free, open-source extension to MediaWiki – the wiki software that powers Wikipedia – that lets you store and query data within the wiki's pages”. Semantic web where knowledge can be assembled, mapped, tagged, structured to search for content in a more effective way",1.0,2.0,,,,,,1.0,,,2.0,,,1.0,,,,,,,,,,,1.0,,,,
Underlay,Search curated web information,"“The Underlay is a global, distributed graph of public knowledge. [...] This is an attempt to replicate the richness of private knowledge graphs in a public, decentralized manner."" Semantic web where knowledge can be assembled, mapped, tagged, structured to search for content in a more effective way.",1.0,2.0,,,,,,1.0,,,2.0,,,1.0,,,,,,,,,,,1.0,,,,
Government of Singapore,Limit spreading of falsehoods on social media,"Singapore’s government in 2019 enforced regulations that require labeling of social network posts that spread falsehoods, for example. During the Covid-19 pandemic, social media tagged misinformation, partially with the help of users who surfaced suspicious information early. In general, research has shown that relatively small groups of laypeople can identify factual bias from small amounts of text, such as titles and subtitles, which bodes well for machine-enhanced crowdsourcing of fact checking.",1.0,,,2.0,,,,1.0,,,2.0,,,1.0,,,,,,1.0,,,,,,,,,
Facebook,Moderate and limit bias of social media content,"AI only knows what it is taught by the data it is fed and how it is trained on that data. Bias can creep into both. For example, AI learns bias if the sample data inadvertently excludes certain ethnicities, or if a small AI team passes on its own bias. AI deployment for network information should have processes and governance that minimize mistakes leading to bias. Facebook, for instance, is starting down this path with its content moderation oversight body.",1.0,,,2.0,,,,1.0,,,2.0,,1.0,1.0,,,,,,,,,,,1.0,,,,
FlightRadar24,Use flight data for decentralized analysis,"Routes of airplanes (e.g., through FlightRadar24) and ships are available publicly, which adds data to understand, among others, CO2 emissions sources.",1.0,1.0,,,,,,,1.0,,2.0,,,1.0,,,,,,1.0,,,,,,,,,
Spotify,Discover Weekly to encourage diversity in media consumption,"To prevent media bubbles, we can rework the algorithms for instance by introducing rules that limit the amount of unproven information they feed to large groups, or force serendipity into the choices of content served (an example of this is Spotify Discover Weekly functionality that can encourage exploration beyond one’s comfort zone)",1.0,1.0,,,,,,2.0,,,2.0,,,1.0,,,,1.0,,,,,,,,,,,
WithTally,Consolidate data from multiple blockchain governances,"Decentralized Autonomous Organization (DAO), withTally is a voting dashboard to aggregate information from disparate Defi governance structures such as Compound or Uniswap;",1.0,,,,,1.0,,,,,2.0,,,1.0,1.0,,,,,,,,,,,,,,
Startupy.world,Curate startup knowledge,"Founders, funders, creatives, and creators need a dedicated place to collect and connect the dots. Startupy plans to be a community-powered database for startup knowledge, organized associatively. Startupy would incentivize experts to contribute startup knowledge and gain an internet-wide reputation in specific domains. ",1.0,1.0,,,,,1.0,2.0,,,2.0,,,1.0,1.0,,,,,,,,,1.0,,,,,
Microsoft,Inventory and query science documentation,Microsoft Academic Graph (MAG) - is a scientific database with more than 236M documents,1.0,2.0,,,,1.0,,2.0,,1.0,2.0,,,1.0,,,,,,,,,,,,,,1.0,
First Monday,"Publish a web-based, open, peer-reviewed scientific journal ","First Monday is one of the first openly accessible, peer–reviewed journals on the Internet, solely devoted to the Internet. Since its start in May 1996 and as of early 2022, First Monday has published 2,133 papers in 309 issues, written by 3,107 different authors.",1.0,,1.0,,2.0,,,2.0,,,2.0,,,1.0,,,,,,,,,,,,,,1.0,
OpenCell,Research biology through open database of proteome data,"OpenCell is a proteome-scale collection of protein localization and interaction measurements in human cells made thanks to CRISPR technology. It is built upon a library of 1,310 endogenously-tagged HEK293T cell lines that enables researchers to observe both protein localization (using live-cell fluorescence microscopy) and protein-protein interactions (using IP-MS) in the same cellular context.",1.0,2.0,,,,,,1.0,,,2.0,,1.0,1.0,,,,,1.0,,,,,,,,,,
Gyanai.com,Research topics through AI,"Search engines don't structure research topics well, but other NLP tools like Gyan.ai attempt to provide richer content quality by using a combination of web and database search, and knowledge graph technology. ",1.0,1.0,,,,,,1.0,,,2.0,,,,,1.0,,,,,,,,,,,,,
Metafactory.ai,Decentralize brand building,"So-called headless brands are increasingly important in consumer products, especially fashion and apparel. Decentralized, independent producers and influencers bypass or complement established brands and their marketing. Infrastructure like Metafactory helps them organize - throughout their supply chain, and thanks to crypto assets such as NFTs (non fungible tokens). ",1.0,,2.0,,,,1.0,,2.0,,2.0,1.0,,1.0,2.0,,,1.0,,,,,,,,,,,
IPCC,Summarizing the insights for climate change science,"The IPCC (Intergovernmental Panel for Climate Change) report, for instance its major 2022 release, is a global effort to summarize the entire scientific fact base around climate science, in an attempt to influence public policy and industry strategy. Its output is an inventory of the research published and its principal conclusions. ",1.0,1.0,,,1.0,1.0,,1.0,,,2.0,,,,1.0,,1.0,,,,,,,,,,,,
"Large communities from Apple, PatientsLikeMe, Wikipedia",Produce intellectual property or curate knowledge ,"Can communities create and store technical knowledge? Online communities are one of the largest emerging social phenomena of the last quarter-century. Apple is one of the most prominent nodes, and the algorithms of both Facebook and YouTube exercise significant control on how those communities behave. Communities provide creativity and additional resources that are typically not accessible by normal hierarchical organization. But they’re harder to set up and direct.",1.0,2.0,2.0,,2.0,2.0,1.0,2.0,2.0,1.0,1.0,1.0,,2.0,,,,,,,,1.0,,,,,,,
Amazon product displays,Help people make consumer purchase choices,"On Amazon, product displays are governed by democratic user votes that guide the visualization of items when searching or filtering by “customer rating,” but ultimately the hierarchical Amazon category management can decide to delist the product.",1.0,,,2.0,,,1.0,2.0,,,1.0,,1.0,1.0,1.0,,,1.0,,,,,,,,,,,
"General pattern recognition through AI, etc",Reward worthwhile content and penalize spam or fake inputs,"Use machine learning to identify participants who are worth rewarding; to detect spam or fake inputs; to identify structures in high-volume process flows, etc. These can either trigger an automated response or be passed on to a human (or a network) for validation.
",1.0,,,2.0,,,,2.0,,,1.0,,2.0,,,,,,,,,1.0,,,,,,,
Xerox Eureka,Help share knowledge across technicians,Xerox Eureka community helped share knowledge across technicians. One of the first crowdsourced technical community forums in the world. ,1.0,2.0,1.0,,1.0,1.0,,1.0,1.0,1.0,1.0,1.0,,1.0,,,,,,,1.0,,,,,,,,
GoodJudgment,Access super forecasters insights,Situations where data sets are insufficient for machines to operate independently. Swarm AI predictions; computing likelihood of human predictions; Early Warning Project to predict mass atrocities. Initially driven by University of Pennsylvania to support IARPA (US intelligence community’s equivalent to DARPA). ,1.0,,2.0,,,1.0,,1.0,,1.0,1.0,,1.0,1.0,,,,,,,,,,,,,,,
WeFarm.com,Improve farming,"Farming peer-sharing, decision-making platform for small farmers. Exchange of practices, dynamically evolving as new conditions emerge",1.0,2.0,1.0,,1.0,1.0,,2.0,2.0,1.0,1.0,1.0,,1.0,,,,,,,,,,,,1.0,,,
Consulting knowledge curation and management,"Industrialize the finding, improving, and sharing of valuable knowledge","Many consulting firms have communities of practice that form around appointed leaders and serve as watering holes for consultants. However, in this case, the firm uses those nodes as deliberate actors of a tightly knit learning platform enabling the reskilling of tens of thousands of employees. An important element of this infrastructure is the exoskeleton of resources that helps the knowledge nodes to scale. Knowledge management curators, community managers, and advanced analytics that feed the nodes with the latest information about learning patterns and learner experience diagnostics, nodes obtain a rich feedback loop from the system and redirect the execution accordingly.",1.0,2.0,,,,,,2.0,,,1.0,,,1.0,,,,,,,,,,1.0,,,,,
"Reddit, Quora, (LinkedIn)",Discuss and share knowledge,"While not fully managed, these communities benefit from infrastructure and rules that a third party has created. For example, LinkedIn has interest groups that connect people with shared knowledge.",1.0,1.0,1.0,,1.0,1.0,,1.0,1.0,1.0,1.0,1.0,,2.0,,,,,,,,,,,,,,,
Ubuntoo.com,Find environmental solutions,"Ubuntoo is a Service provider that brings together experts and knowledge, focused on environmental sustainability innovation.",1.0,1.0,2.0,,1.0,1.0,1.0,1.0,2.0,1.0,1.0,1.0,,1.0,,,,,,,,,,1.0,,,,,
Pinduoduo,Link large producers directly with pooled groups of consumers,"Pinduoduo enables groups of consumers to pool their purchases of farm products and connect directly with farmers and distributors to obtain better price and service, and ultimately better efficiency of the agricultural value chain. Hundreds of millions of people use it today. During the Coronavirus outbreak, which affected traditional wholesale distribution networks, Pinduoduo helped farmers sell perishable stock.",1.0,,1.0,2.0,1.0,1.0,1.0,,,2.0,1.0,,,,2.0,,,1.0,,,,,,,,,,,
Grevy’s Zebra Trust,Apply image recognition software to monitor environmental changes,"Grevy’s Zebra Trust has the Wild Me platform to support volunteer and scientists rallies in a wildlife conservancy area. The emerging risk that these platforms need to manage is that they may inadvertently give poachers a way to find animals. Authentication and identity control can be a solution, not unlike in other parts of the web.",1.0,2.0,,,,,,1.0,,,1.0,,1.0,1.0,,,,,,,,,,,,,1.0,,
"GROW, OneSoil.ai",Use citizen Observatories projects to monitor agricultural developments,"Expanding on GEOSS (Global Earth Observation System of Systems), the Citizen Observatories projects are funded by the European Union. One of them is GROW (soil-moisture citizen observatory) aimed at climate change and including scientists, NGOs, communities and individuals. Computer vision sifts through mixed-source (people, machines) imagery from both people and machines to enable better agricultural decisions at OneSoil.ai.",1.0,2.0,,1.0,1.0,,,1.0,,,1.0,,1.0,1.0,,,,,,,,,,,,1.0,,,
BlackShore.eu,Create maps and correct computer-created maps,Europe’s BlackShore.eu uses gamified crowdsourcing to create maps; it operates in a similar space as OpenStreetMap,1.0,1.0,,2.0,1.0,,,,1.0,,1.0,,1.0,1.0,,,,,,,,1.0,,,,,,,
Nippon Foundation and GEBCO Seabed project,Crowdsource and bot-source maps,"The Nippon Foundation and GEBCO Seabed project, launched in 2017, has by now mapped over 10% of the Earth’s oceanic floors. The next phase will include crowdsourcing of data by appending echo- sounding equipment to all sorts of vessels, based on their routes. Along similar lines, swarms of bots could possibly one day act as sensor networks canvassing larger spaces in a dynamic, adaptable manner.",1.0,1.0,1.0,,1.0,,,,1.0,,1.0,,1.0,1.0,,,,,,,,,,,,,1.0,,
DisplaCy,Discover related information in text,"Identifying the words that describe the space being searched (the semantic network that delineates ontologies e.g. words that are ideally MECE - mutually exclusive and hopefully collectively exhaustive) can be done either heuristically by asking experts to map out the words and clustering them in groups, or even analytically by extracting so-called “entities” by using R or Python NLTK - or more specialized entity visualizers like DisplaCy - to identify words recurrence in typical content.",1.0,,1.0,1.0,1.0,,,1.0,,,1.0,,1.0,,,,,,,,,,,,,,,,
Qatari government - Dataminr,"Combine human- and machine-sourced text, images, audio","Developed in Qatar, the Crisis Computing group combines multiple sources of text and image data, as well as audio streams, both crowd and machine sourced – in the case of “First Alert” system it uses them to highlight potential crises early. Elsewhere, Dataminr.com combines multiple sources of text and image data, as well as audio streams, both crowd and machine sourced – in the case of “First Alert” system it uses them to highlight potential crises early.",1.0,,,,,,,1.0,,,1.0,,,1.0,,,,,,1.0,,,,,,,,,
Tweepy,Analyze natural language through Python,"Big data analytics languages like Python are already equipped with extensions to mine social media data. For instance, for Python, Tweepy enables it to connect relatively simply to Twitter’s API and analyze its natural language.",1.0,,,,,,,1.0,,,1.0,,,,,,,,,,,,,,,,,,
Wefarm.co,Enable collaboration for small-scale farmers in Africa,"In Africa, Wefarm.co helps millions of small-scale farmers to connect with each other – both through web and SMS - and exchange solutions to their questions.",1.0,1.0,,,1.0,1.0,,1.0,2.0,,1.0,1.0,,1.0,,,,,,,,,,,,1.0,1.0,,
Genpact,Employees learn-by-doing,"A marketplace of learning-by-doing opportunities allows learners to consolidate memorization of the learning curriculum by executing small projects in mostly virtual settings. They leverage Microsoft Office 365 including Teams, as well as the core functionality of a Learning Experience Platform (Edcast). The latter also facilitates collaboration by enabling fluid feedback from the learners on specific parts of the curriculum.",1.0,,,1.0,,1.0,,1.0,,1.0,1.0,,,1.0,1.0,,,,,,,,,,,,,1.0,
Amnesty Decoders,Crowdsource forensics for humanitarian crises,"An organizational construct used by Amnesty International which uses its volunteers in Amnesty Decoders, for instance in Decode Darfur which asked participants to identify destroyed areas in the settlements of Darfur using satellite images. Salient characteristics of Amnestty Decoders are: a) annotated data sets created by crowds; b) clustering of human language inputs; c) automated translations; d) automated classification of visual objects. A specific use case is ""Troll Patrol"" that targets social media misinformation and obfuscation. ",1.0,,,1.0,,,,,1.0,,1.0,,1.0,1.0,,,,,,1.0,,,,,,,,,
Wefarm.co,Foster peer-to-peer community of developing-economy farmers,"More than a million people use Wefarm.co in Kenya and Uganda, with over 40,000 questions answered every day. Using the technology platform is very simple and is also possible through SMS for those who don’t have access to internet. Interestingly, natural language processing is utilized to facilitate the exchanges in three regional languages in addition to English.",1.0,2.0,,,1.0,,,1.0,2.0,1.0,1.0,2.0,,1.0,,,,,,,,,,,,1.0,,,
Exponential View,Deliver insightful media coverage ,"Journalist and entrepreneur Azeem Azhar’s Exponential View media source, which includes a podcast in collaboration with Harvard Business Review, is synergistic with a newsletter as well as a community of thought leaders run on Slack. The three elements reinforce each other.",1.0,,1.0,,1.0,1.0,,2.0,,,1.0,,,1.0,,,,,,,,,,,1.0,,,,
"StackOverflow, SAP Community Network",Answer coding questios and share knowledge,"StackOverflow is an independent, open community for anyone that codes, with the joint objective to get answers to the toughest coding questions, share knowledge with coworkers in private (and find a job, which acts as a powerful motivator). Other software vendors have been collaboration communities for many years, such as SAP Community Network.",1.0,2.0,2.0,,1.0,1.0,1.0,,2.0,,1.0,2.0,,1.0,,,,,,,,1.0,,,,,,,
"Kriya.ai, Talkpush",Engage with networks of people through bots,"Large groups of people can and increasingly will be initially engaged by bots, that can execute a simplified yet human-like conversation with the targets, taking an example from recruitment campaigns that have started utilizing such tools (e.g. Kriya.ai, Talkpush).",1.0,,,,,,,1.0,,1.0,1.0,,,1.0,,,,,,,,,,,,,,,
"Etsy.com, Kaggle, Netflix",Heed to microsegmented preferences in entertainment and creation,"Intelligent systems can create product designs on Etsy.com, or a new algorithm on Kaggle to predict your Netflix movie preferences. Or use generative design where machine learning-based algorithms help create and filter dozens of options that humans, either individually or in groups, enhance and decide upon.",1.0,,1.0,,,,1.0,,1.0,,1.0,,,,2.0,,,,,,,,,,,,,,
Google ,Enable counterterrorism activities,"Proactively bring pro-social voices into the community forums. An example of this is Google Jigsaw, which for instance was used to build anti-terrorism narratives leveraging AdWords and YouTube in an effort to disrupt ISIS’ recruitment networks",1.0,1.0,,,,,,2.0,,,1.0,,,1.0,,,,,,1.0,,,,,,,,,
GenBank,Harness an open-access genomics database (USA),"GenBank, an open-access repository of genome sequences run by America’s National Institutes of Health. It was used for the first analyses of the genomic sequences of Covid-19. [Source: Azeem Azhar, ""Exponential""]",1.0,2.0,,,,1.0,,,,2.0,1.0,,,1.0,,,,,1.0,,,,,,,,,,
BioBank,Harness an open-access genomics and health database (UK),"UK Biobank collates the medical and genomic data of 500,000 people. Each has consented to researchers using their data to better understand and prevent serious disease. And any legitimate researcher can access this resource. By 2020, more than 20,000 researchers were doing so. [Source: Azeem Azhar, ""Exponential""]",1.0,2.0,,,,1.0,,,,2.0,1.0,,,1.0,,,,,1.0,,,,,,,,,,
Citimart,Improve cities' procurement processes,"Citimart is a platform that helps cities to get more innovative in their procurement processes, by enlarging the vendor and subject matter experts’ pools, and enables the sharing of outcomes and learnings from respective implementations.",1.0,1.0,,,1.0,1.0,,,1.0,2.0,1.0,,,,,,1.0,,,1.0,,,,,,,,,
Project Dorian,"Label datasets for AI by frontline responders, human-in-the-loop technology development","Ensuring human oversight of algorithms after deployment can help to identify and correct these errors in a timely manner. For this project, a group of volunteers from the Montgomery County Community Emergency Response Team (MCERT) helped to check and correct labels assigned by the AI classifier. This participatory approach, known as human-in-the-loop, was used to verify the classifications being made by the system and correct any mistakes in real time. The process also resulted in a novel image dataset with expert labels of damage to further train the algorithm and improve its accuracy during future deployments.During the two-week period that followed the landfall of Hurricane Dorian, the system was deployed to collect and filter social media images. Approximately 160,000 images were tagged as relevant by the system, with ~26,000 of these containing some damage content. All images that the system ranked as severe or mild were sent for human validation. Using a dedicated web-interface for microtasking to support humanitarian efforts, local domain experts from MCERT examined this evolving sample, performing a two-stage verification. They first checked if the image contained damage content and then assigned a severity level based on a predetermined taxonomy. The research team also developed a detailed tutorial to ensure that all labellers were approaching the task in a consistent manner. The corrections made by the community responders helped to identify common types of errors made by the algorithm. For example, the AI system struggled with images taken from afar or in low-light and poor resolution settings. Isolating this weakness helped the technical team to develop targeted improvements and the response teams to better understand the potential added value of the AI tool for their operations during crisis response. (Source: Nesta UK)",1.0,1.0,,1.0,2.0,,,,1.0,,1.0,1.0,2.0,1.0,,,,,,,,,,,,,,,
Morocco's government,Facilitate economic policy development ,"Morocco utilized a collective intelligence method in 2019 to inform its economic policy and generally its development. The process involved social media outreaches and input, coupled with workshops with multiple underserved constituency. ",1.0,,1.0,,,,,,1.0,,1.0,1.0,,,,,1.0,,,1.0,,,,,,,,,
