BioLeft,Open-source agricultural seeds breeding and distribution,"Bioleft is a community of open source seed exchange and breeding to offer solutions to the challenges of agriculture. In their words: ""Bioleft is a community that builds an open seed exchange and breeding network to offer alternative solutions to the challenges of agriculture. Based on collective intelligence, open knowledge, agreements and solidarity, we develop social and technological innovations that allow the exchange of information. We link local and scientific knowledge to enhance the role of farmers in seed conservation and breeding. In this way they generate a greater availability of biodiverse and resilient seeds, considered as a commons.""",1.0,1.0,1.0,,1.0,1.0,,,1.0,1.0,1.0,1.0,,1.0,,,,,,,,,,,,,1.0,,,
Crowdmapping,Enable crowdmapping,"Apart from OpenStreetMap, other technologies such as MapBox and Mapillary and https://tasks.hotosm.org/ are available. ",2.0,1.0,,,,1.0,,,1.0,,,1.0,1.0,1.0,,,,,,,1.0,,,,,,,,,1.0
SIKU,Harness indigenous knowledge,"Inuit ice knowledge combined with geospatial data. Community driven mapping of ice conditions and interpretation of related risks, to increase safety https://en.unesco.org/courier/2019-1/siku-mixing-high-tech-ancient-know-how",2.0,1.0,,,,1.0,,,1.0,,1.0,1.0,,1.0,,,,,,,1.0,,,,,,,1.0,,
Indonesian government,Surface and process citizen complaints,Platform enabling citizens to lodge anonymous or confidential complaints against public Indonesian bodies. https://www.lapor.go.id/,2.0,1.0,,,,,,,1.0,1.0,,1.0,,,,,,1.0,,,1.0,,,,,,,,,
Opencare.cc,Redesign healthcare by surfacing health communities ideas,"""Contributing towards care provision reform. opencare aims at studying on what constitutes best practice in the field of community based collective intelligence projects in the field of care provision, and on how these solutions might be integrated in national social and health care systems. The opencare consortium will develop a software stack to monitor and assist collective intelligence social dynamics in online communities. We develop software to help the community make sense by identifying points of consensus and controversy, summarizing, and structuring arguments.""",1.0,1.0,1.0,,1.0,1.0,,,1.0,,1.0,1.0,,1.0,,,,,,1.0,,,,,,,,,,
Cureaccelerator.org,Facilitate the repurposing of drugs,"CureAccelerator supports “proof of concept” research repurposing drugs, devices and nutriceuticals already approved for human use. On CureAccelerator, funders have direct access to repurposing research, researchers can post ideas and connect with peers and funding, and clinicians can contribute their experience of off-label use in need of validation.",1.0,1.0,1.0,1.0,1.0,1.0,,,1.0,,1.0,1.0,,1.0,1.0,,,,,1.0,,,,,,,,,,
GoT,Organize labor,"Indonesia's commercial drivers organically created a supporting community centered around Twitter, called Gojer on Twit (GoT). The organization helped them counter the information advantage that ride-hailing algorithms have over individual workers. ",1.0,1.0,,,,2.0,,,1.0,1.0,,1.0,,1.0,,,,,1.0,,,,,,,,,,,
Huggingface,Write better AI code,"Huggingface.co uses a community to inventory mostly Natural Language Processing (NLP) code, especially pretrained models for specific use cases and hardware. The community also helps making the code better. Its infrastructure shares commonalities with GitHub. ",,1.0,2.0,,,1.0,,,1.0,1.0,1.0,1.0,,1.0,,,,,,,,,2.0,,,,,,,
